{
  "schema_version": "1.0",
  "generated_at": "2026-04-21T10:15:00Z",
  "repo": {
    "name": "pre-1.2.0-repo",
    "root": "/tmp/pre-1.2.0-repo",
    "package_manager": "npm",
    "monorepo": false,
    "workspaces": [],
    "vcs": {
      "kind": "git",
      "remote_host": "github.com",
      "default_branch": "main"
    }
  },
  "entry_points": [],
  "languages": [
    { "name": "TypeScript", "file_count": 2, "dominant_framework": null }
  ],
  "dependencies": {},
  "architecture": {
    "summary": "Minimal envelope pre-dating 1.2.0 — no file_inventory field present.",
    "layers": [
      { "name": "src", "paths": ["src"], "purpose": "source" }
    ],
    "notable_anti_patterns": []
  },
  "security_surface": {
    "auth_paths": [],
    "network_egress": [],
    "secrets_referenced": [],
    "crypto_calls": [],
    "csp_headers": []
  },
  "git_history": {
    "branches": {
      "current": "main",
      "main_count": 1,
      "feature_count": 0,
      "names": ["main"]
    },
    "recent_activity": {
      "last_commit_date": "2026-04-20T12:00:00Z",
      "commits_last_30d": 0,
      "authors_last_30d": 0
    },
    "sensitive_file_history": []
  },
  "notes": ["Pre-1.2.0 fixture — intentionally lacks file_inventory."]
}
